<?xml version="1.0" encoding="UTF-8"?>
<tmi8:setgeldigheidsperiode xsi:schemaLocation="http://bison.connekt.nl/tmi8/kv1/msg kv1-index.xsd"  xmlns:tmi8="http://bison.connekt.nl/tmi8/kv1/msg" xmlns:xsi="http://www.w3.org/2001/XMLSchema-instance">
		<!--Delta planning voor de lijnen 17365 en 17400 uit de setgroep ZHN van 1 juni - 15 juli 2015> -->
        <tmi8:dataownercode>ARR</tmi8:dataownercode>
		<tmi8:setcode>ZHN</tmi8:setcode>
        <tmi8:index>3</tmi8:index>
        <tmi8:versie>1</tmi8:versie>
        <tmi8:publicatiedatum>2015-05-10T04:55:00</tmi8:publicatiedatum>
<tmi8:isgeldig>true</tmi8:isgeldig>        <tmi8:startdatum>2015-06-01</tmi8:startdatum>
        <tmi8:einddatum>2015-07-15</tmi8:einddatum>
        <tmi8:isbaseline>false</tmi8:isbaseline>
        
        <tmi8:zipfile>KV1_ARR_ZHN_3_1.zip</tmi8:zipfile>
        <tmi8:kv1dossier>8.1.1.0</tmi8:kv1dossier>
        <tmi8:lijnen>
        	<tmi8:lineplanningnumber>17365</tmi8:lineplanningnumber>
        	<tmi8:lineplanningnumber>17400</tmi8:lineplanningnumber>
        </tmi8:lijnen>	
    </tmi8:setgeldigheidsperiode>
