<?xml version="1.0" encoding="UTF-8"?>
<tmi8:setgeldigheidsperiode xsi:schemaLocation="http://bison.connekt.nl/tmi8/kv1/msg kv1-index.xsd" xmlns:tmi8="http://bison.connekt.nl/tmi8/kv1/msg" xmlns:xsi="http://www.w3.org/2001/XMLSchema-instance">
	<!--In setgroep BW vervallen lijnen 23301 en 23302 miv 1 februari 2015 ==> nieuwe baseline vervangt oude> -->
	<tmi8:dataownercode>ARR</tmi8:dataownercode>
	<tmi8:setcode>BW</tmi8:setcode>
	<tmi8:index>2</tmi8:index>
	<tmi8:versie>1</tmi8:versie>
	<tmi8:publicatiedatum>2015-01-15T15:07:57</tmi8:publicatiedatum>
	<tmi8:isgeldig>true</tmi8:isgeldig>
	<tmi8:startdatum>2015-02-01</tmi8:startdatum>
	<tmi8:einddatum>2015-12-12</tmi8:einddatum>
	<tmi8:isbaseline>true</tmi8:isbaseline>
	<tmi8:zipfile>KV1_ARR_BW_2_1.zip</tmi8:zipfile>
	<tmi8:kv1dossier>8.1.1.0</tmi8:kv1dossier>
</tmi8:setgeldigheidsperiode>
