<?xml version="1.0" encoding="UTF-8"?>
<tmi8:setgeldigheidsperiode xsi:schemaLocation="http://bison.connekt.nl/tmi8/kv1/msg kv1-index.xsd" xmlns:tmi8="http://bison.connekt.nl/tmi8/kv1/msg" xmlns:xsi="http://www.w3.org/2001/XMLSchema-instance">
	<!--Delta planning voor lijn 17400 wordt ingetrokken voor ingangsdatum 1 juni 2015>-->
	<!--Merk op dat hiermee ook lijn 17365 hier wordt ingetrokken, in nieuwe delta planning opnieuw aanbieden>  -->
	<tmi8:dataownercode>ARR</tmi8:dataownercode>
	<tmi8:setcode>ZHN</tmi8:setcode>
	<tmi8:index>3</tmi8:index>
	<tmi8:versie>1</tmi8:versie>
	<tmi8:publicatiedatum>2015-05-29T09:55:00</tmi8:publicatiedatum>
	<tmi8:isgeldig>false</tmi8:isgeldig>
	<tmi8:startdatum>2016-03-29</tmi8:startdatum>
	<tmi8:einddatum>2016-03-29</tmi8:einddatum>
	<tmi8:isbaseline>false</tmi8:isbaseline>
</tmi8:setgeldigheidsperiode>
