<?xml version="1.0" encoding="UTF-8"?>
<!--Sample XML file generated by XMLSpy v2010 rel. 3 sp1 (http://www.altova.com)-->
<!-- Voorbeeldbestand van KV1 index -->
<tmi8:setgeldigheidsperiode xsi:schemaLocation="http://bison.connekt.nl/tmi8/kv1/msg kv1-index.xsd" xmlns:tmi8="http://bison.connekt.nl/tmi8/kv1/msg" xmlns:xsi="http://www.w3.org/2001/XMLSchema-instance">
	<tmi8:dataownercode>DataOwnerCodeVanVervoerder</tmi8:dataownercode>
	<tmi8:setcode>SetCodeVanVervoerder</tmi8:setcode>
	<tmi8:index>999999999</tmi8:index>
	<tmi8:versie>0</tmi8:versie>
	<tmi8:publicatiedatum>2001-12-17T09:30:47Z</tmi8:publicatiedatum>
	<tmi8:isgeldig>true</tmi8:isgeldig>
	<tmi8:startdatum>2016-03-07</tmi8:startdatum>
	<tmi8:einddatum>2016-03-07</tmi8:einddatum>
	<tmi8:isbaseline>0</tmi8:isbaseline>
	<tmi8:zipfile>BestandsNaam.zip</tmi8:zipfile>
	<tmi8:kv1dossier>kv1 versie nummer w.x.y.z 8.1.2.0</tmi8:kv1dossier>
	<tmi8:pptfile>BestandsNaam</tmi8:pptfile>
	<tmi8:pptdossier>ppt versie nummer w.x.y.z 8.1.2.0</tmi8:pptdossier>
	<tmi8:lijnen>
		<tmi8:lineplanningnumber>EenLijn</tmi8:lineplanningnumber>
		<tmi8:lineplanningnumber>EenAndereLijn</tmi8:lineplanningnumber>
	</tmi8:lijnen>
</tmi8:setgeldigheidsperiode>
